DATE,COUNTRY,SOURCE,HEADLINE,SUMMARY,TEXT,IMPACT SCORE,IMPACT LEVEL
4/30/1995,Iran,https://www.state.gov/releases/office-of-the-spokesperson/2026/02/sanctions-to-combat-illicit-traders-of-iranian-oil-and-the-shadow-fleet-2/,Sanctions to Combat Illicit Traders of Iranian Oil and the Shadow Fleet (Press Statement),"Sanctions entities, individuals, and vessels engaged in illicit Iranian oil and petrochemical trade under maximum pressure enforcement.","Sanctions to Combat Illicit Traders of Iranian Oil and the Shadow Fleet (Press Statement): Sanctions entities, individuals, and vessels engaged in illicit Iranian oil and petrochemical trade under maximum pressure enforcement.",5,High
4/15/2014,Russia,https://www.consilium.europa.eu/en/policies/sanctions-against-russia/timeline-sanctions-against-russia/,Foreign Affairs Council focused on the situation in Eastern Ukraine,The Council decided to strengthen sanctions against persons responsible for misappropriating Ukrainian state funds and targeted additional individuals under the assets freeze and travel ban.,Foreign Affairs Council focused on the situation in Eastern Ukraine: The Council decided to strengthen sanctions against persons responsible for misappropriating Ukrainian state funds and targeted additional individuals under the assets freeze and travel ban.,2,Medium
5/12/2014,Russia,https://www.consilium.europa.eu/en/policies/sanctions-against-russia/timeline-sanctions-against-russia/,Agreement on a new set of sanctions,"In light of events in Eastern Ukraine and the illegal confiscation of entities in Crimea, the Council agreed on a new set of sanctions and took note of the preparatory work done by the Commission and Member States on possible targeted measures, as requested by the European Council in March.","Agreement on a new set of sanctions: In light of events in Eastern Ukraine and the illegal confiscation of entities in Crimea, the Council agreed on a new set of sanctions and took note of the preparatory work done by the Commission and Member States on possible targeted measures, as requested by the European Council in March.",2,Medium
6/23/2014,Russia,https://www.consilium.europa.eu/en/policies/sanctions-against-russia/timeline-sanctions-against-russia/,Import ban on goods from Crimea,The Council adopted measures to implement the EU's policy of non-recognition of the illegal annexation of Crimea and decided on a ban on goods originating from Crimea or Sevastopol.,Import ban on goods from Crimea: The Council adopted measures to implement the EU's policy of non-recognition of the illegal annexation of Crimea and decided on a ban on goods originating from Crimea or Sevastopol.,4,High
6/26/2014,Russia,https://www.consilium.europa.eu/en/policies/sanctions-against-russia/timeline-sanctions-against-russia/,European Council conclusions,EU leaders set out four specific steps to be taken by Russia and the separatists for de-escalation. They also signed the Association Agreement with Ukraine.,European Council conclusions: EU leaders set out four specific steps to be taken by Russia and the separatists for de-escalation. They also signed the Association Agreement with Ukraine.,1,Low
7/16/2014,Russia,https://www.consilium.europa.eu/en/policies/sanctions-against-russia/timeline-sanctions-against-russia/,Special meeting of the European Council,EU leaders regretted that Russia and the separatists had not taken the requested steps set out in the June European Council conclusions. They agreed to target Russia with a new set of 6 restrictive measures including restriction on economic cooperation with Russia.,Special meeting of the European Council: EU leaders regretted that Russia and the separatists had not taken the requested steps set out in the June European Council conclusions. They agreed to target Russia with a new set of 6 restrictive measures including restriction on economic cooperation with Russia.,1,Low
7/18/2014,Russia,https://www.consilium.europa.eu/en/policies/sanctions-against-russia/timeline-sanctions-against-russia/,Ukraine crisis: EU broadens remit of sanctions,The Council widened the legal basis for EU restrictive measures making it possible to target entities which materially or financially support actions against Ukraine.,Ukraine crisis: EU broadens remit of sanctions: The Council widened the legal basis for EU restrictive measures making it possible to target entities which materially or financially support actions against Ukraine.,1,Low
7/22/2014,Russia,https://www.consilium.europa.eu/en/policies/sanctions-against-russia/timeline-sanctions-against-russia/,Council takes action following the downing of flight MH17,"EU ministers discussed the situation in Ukraine following the downing of flight MH17. They asked to finalise preparatory work for economic sanctions in four sectors, paving the way for their adoption.","Council takes action following the downing of flight MH17: EU ministers discussed the situation in Ukraine following the downing of flight MH17. They asked to finalise preparatory work for economic sanctions in four sectors, paving the way for their adoption.",5,High
7/25/2014,Russia,https://www.consilium.europa.eu/en/policies/sanctions-against-russia/timeline-sanctions-against-russia/,Further EU sanctions over situation in Eastern Ukraine,The Council adopted reinforced EU sanctions. The Council's Committee of Permanent Representatives (Coreper) also discussed the preparatory work on further targeted measures.,Further EU sanctions over situation in Eastern Ukraine: The Council adopted reinforced EU sanctions. The Council's Committee of Permanent Representatives (Coreper) also discussed the preparatory work on further targeted measures.,1,Low
7/29/2014,Russia,https://www.consilium.europa.eu/en/policies/sanctions-against-russia/timeline-sanctions-against-russia/,Adoption of additional restrictive measures against Russia,"Following the conclusions of the European Council meeting of 16 July, the Council adopted a package of targeted 'economic sanctions'. These measures concern exchanges with Russia in specific economic sectors.","Adoption of additional restrictive measures against Russia: Following the conclusions of the European Council meeting of 16 July, the Council adopted a package of targeted 'economic sanctions'. These measures concern exchanges with Russia in specific economic sectors.",5,High
8/30/2014,Russia,https://www.consilium.europa.eu/en/policies/sanctions-against-russia/timeline-sanctions-against-russia/,Special meeting of the European Council,"Following the dramatic escalation of the situation, with the presence and actions of Russian armed forces on the Ukrainian territory, the European Council asked for the preparation of new economic sanctions against Russia.","Special meeting of the European Council: Following the dramatic escalation of the situation, with the presence and actions of Russian armed forces on the Ukrainian territory, the European Council asked for the preparation of new economic sanctions against Russia.",5,High
9/12/2014,Russia,https://www.consilium.europa.eu/en/policies/sanctions-against-russia/timeline-sanctions-against-russia/,Further economic sanctions on Russia,"A new package of restrictive measures targeting exchanges with Russia in specific economic sectors entered into force, reinforcing the measures adopted on 31 July.","Further economic sanctions on Russia: A new package of restrictive measures targeting exchanges with Russia in specific economic sectors entered into force, reinforcing the measures adopted on 31 July.",5,High
11/17/2014,Russia,https://www.consilium.europa.eu/en/policies/sanctions-against-russia/timeline-sanctions-against-russia/,New sanctions under consideration,Ukraine was the main focus of the Foreign Affairs Council. EU ministers asked the European External Action Service (EEAS) and the European Commission to present a proposal on further sanctions against separatists.,New sanctions under consideration: Ukraine was the main focus of the Foreign Affairs Council. EU ministers asked the European External Action Service (EEAS) and the European Commission to present a proposal on further sanctions against separatists.,1,Low
11/28/2014,Russia,https://www.consilium.europa.eu/en/policies/sanctions-against-russia/timeline-sanctions-against-russia/,EU strengthens sanctions against separatists in Eastern Ukraine,"As requested by the Foreign Affairs Council of 17 November, an asset freeze and an EU travel ban were imposed to 13 persons and five entities involved in action against Ukraine's territorial integrity. This decision brought the total of persons subject to EU sanctions over Ukraine's territorial integrity to 132 and the number of entities under EU asset freeze to 28.","EU strengthens sanctions against separatists in Eastern Ukraine: As requested by the Foreign Affairs Council of 17 November, an asset freeze and an EU travel ban were imposed to 13 persons and five entities involved in action against Ukraine's territorial integrity. This decision brought the total of persons subject to EU sanctions over Ukraine's territorial integrity to 132 and the number of entities under EU asset freeze to 28.",1,Low
12/18/2014,Russia,https://www.consilium.europa.eu/en/policies/sanctions-against-russia/timeline-sanctions-against-russia/,European Council focused on the eastern neighbourhood,"EU leaders discussed the situation on the eastern borders of Europe, support to Ukraine and relations with Russia. They welcomed the strengthening of the sanctions on investment, services and trade with Crimea and Sevastopol.","European Council focused on the eastern neighbourhood: EU leaders discussed the situation on the eastern borders of Europe, support to Ukraine and relations with Russia. They welcomed the strengthening of the sanctions on investment, services and trade with Crimea and Sevastopol.",2,Medium
12/18/2014,Venezuela,https://www.congress.gov/bill/113th-congress/senate-bill/2142/text,Venezuela Defense of Human Rights and Civil Society Act of 2014,"The U.S. Congress cited severe economic and political deterioration in Venezuela, including inflation exceeding 56% in 2013, widespread scarcity of basic goods, strict currency controls harming business activity, and a dramatic rise in violent crime. The Act highlighted systemic human rights abuses, erosion of judicial independence, intimidation of political opponents, and consolidation of executive power under Presidents Chávez and Maduro. Based on these findings, sanctions were authorized against individuals responsible for human rights violations and suppression of civil society.","Venezuela Defense of Human Rights and Civil Society Act of 2014: The U.S. Congress cited severe economic and political deterioration in Venezuela, including inflation exceeding 56% in 2013, widespread scarcity of basic goods, strict currency controls harming business activity, and a dramatic rise in violent crime. The Act highlighted systemic human rights abuses, erosion of judicial independence, intimidation of political opponents, and consolidation of executive power under Presidents Chávez and Maduro. Based on these findings, sanctions were authorized against individuals responsible for human rights violations and suppression of civil society.",3,Medium
12/19/2014,Venezuela,https://www.federalregister.gov/documents/2015/03/11/2015-05677/blocking-property-and-suspending-entry-of-certain-persons-contributing-to-the-situation-in-venezuela,Blocking Property and Suspending Entry of Certain Persons Contributing to the Situation in Venezuela,"This order blocked all U.S.-based property and financial interests of individuals identified as undermining democratic institutions in Venezuela. It targeted persons involved in human rights abuses, violent repression of antigovernment protests since February 2014, restrictions on freedom of expression and assembly, and public corruption by senior officials. It also applied to current or former government officials, individuals providing material or financial support to sanctioned persons, and entities owned or controlled by them.","Blocking Property and Suspending Entry of Certain Persons Contributing to the Situation in Venezuela: This order blocked all U.S.-based property and financial interests of individuals identified as undermining democratic institutions in Venezuela. It targeted persons involved in human rights abuses, violent repression of antigovernment protests since February 2014, restrictions on freedom of expression and assembly, and public corruption by senior officials. It also applied to current or former government officials, individuals providing material or financial support to sanctioned persons, and entities owned or controlled by them.",2,Medium
12/20/2014,Venezuela,https://www.congress.gov/bill/114th-congress/senate-bill/2845/text,Venezuela Defense of Human Rights and Civil Society Extension Act of 2016,"This Act extended the termination date of sanctions imposed under the 2014 Human Rights Act. By prolonging sanctions through December 31, 2019, the U.S. Congress reaffirmed continued concern over unresolved human rights violations, democratic backsliding, and lack of institutional reforms within Venezuela.","Venezuela Defense of Human Rights and Civil Society Extension Act of 2016: This Act extended the termination date of sanctions imposed under the 2014 Human Rights Act. By prolonging sanctions through December 31, 2019, the U.S. Congress reaffirmed continued concern over unresolved human rights violations, democratic backsliding, and lack of institutional reforms within Venezuela.",1,Low
12/21/2014,Venezuela,https://www.federalregister.gov/documents/2017/08/29/2017-18468/imposing-additional-sanctions-with-respect-to-the-situation-in-venezuela,Imposing Additional Sanctions With Respect to the Situation in Venezuela,"This executive order restricted U.S. persons from engaging in transactions involving new debt and equity issued by the Government of Venezuela and PDVSA. It prohibited long-maturity debt, trading of existing government bonds, and dividend payments to the Venezuelan state. The measures aimed to limit the government’s access to international financial markets and prevent the use of U.S. capital to sustain the Maduro regime.","Imposing Additional Sanctions With Respect to the Situation in Venezuela: This executive order restricted U.S. persons from engaging in transactions involving new debt and equity issued by the Government of Venezuela and PDVSA. It prohibited long-maturity debt, trading of existing government bonds, and dividend payments to the Venezuelan state. The measures aimed to limit the government’s access to international financial markets and prevent the use of U.S. capital to sustain the Maduro regime.",4,High
12/22/2014,Venezuela,https://www.federalregister.gov/documents/2018/03/21/2018-05916/taking-additional-steps-to-address-the-situation-in-venezuela,Taking Additional Steps to Address the Situation in Venezuela,"This order prohibited all U.S. transactions involving digital currencies, coins, or tokens issued by or on behalf of the Venezuelan government after January 9, 2018. The measure directly targeted state-backed cryptocurrencies, including the Petro, which were viewed as mechanisms to bypass existing U.S. financial sanctions and access alternative sources of funding.","Taking Additional Steps to Address the Situation in Venezuela: This order prohibited all U.S. transactions involving digital currencies, coins, or tokens issued by or on behalf of the Venezuelan government after January 9, 2018. The measure directly targeted state-backed cryptocurrencies, including the Petro, which were viewed as mechanisms to bypass existing U.S. financial sanctions and access alternative sources of funding.",1,Low
12/23/2014,Venezuela,https://www.federalregister.gov/documents/2018/05/24/2018-11335/prohibiting-certain-additional-transactions-with-respect-to-venezuela,Prohibiting Certain Additional Transactions With Respect to Venezuela,"This order prohibited U.S. persons from purchasing Venezuelan government debt, including accounts receivable, and restricted the use of such debt as collateral. It also barred the sale or transfer of government-owned equity in entities where the state held a majority stake. These measures sought to prevent asset stripping, debt monetization, and circumvention of prior sanctions.","Prohibiting Certain Additional Transactions With Respect to Venezuela: This order prohibited U.S. persons from purchasing Venezuelan government debt, including accounts receivable, and restricted the use of such debt as collateral. It also barred the sale or transfer of government-owned equity in entities where the state held a majority stake. These measures sought to prevent asset stripping, debt monetization, and circumvention of prior sanctions.",2,Medium
12/24/2014,Venezuela,https://www.federalregister.gov/documents/2018/11/02/2018-24254/blocking-property-of-additional-persons-contributing-to-the-situation-in-venezuela,Blocking Property of Additional Persons Contributing to the Situation in Venezuela,"This action expanded sanctions to individuals operating in Venezuela’s gold sector and other designated sectors of the economy. It targeted those engaged in corruption, deceptive financial practices, or illicit transactions benefiting the Venezuelan government. The order also applied to individuals providing material or technological support to sanctioned actors and to entities owned or controlled by them.","Blocking Property of Additional Persons Contributing to the Situation in Venezuela: This action expanded sanctions to individuals operating in Venezuela’s gold sector and other designated sectors of the economy. It targeted those engaged in corruption, deceptive financial practices, or illicit transactions benefiting the Venezuelan government. The order also applied to individuals providing material or technological support to sanctioned actors and to entities owned or controlled by them.",3,Medium
12/25/2014,Venezuela,https://www.federalregister.gov/documents/2019/01/30/2019-00615/taking-additional-steps-to-address-the-national-emergency-with-respect-to-venezuela,Taking Additional Steps To Address the National Emergency With Respect to Venezuela,"This order broadened the legal definition of the “Government of Venezuela” to include the Central Bank of Venezuela, PDVSA, and all entities acting directly or indirectly on behalf of the Maduro regime. This clarification closed legal loopholes and ensured comprehensive enforcement of existing sanctions across all state-controlled institutions.","Taking Additional Steps To Address the National Emergency With Respect to Venezuela: This order broadened the legal definition of the “Government of Venezuela” to include the Central Bank of Venezuela, PDVSA, and all entities acting directly or indirectly on behalf of the Maduro regime. This clarification closed legal loopholes and ensured comprehensive enforcement of existing sanctions across all state-controlled institutions.",4,High
12/26/2014,Venezuela,https://www.federalregister.gov/documents/2019/08/07/2019-17052/blocking-property-of-the-government-of-venezuela,Blocking Property of the Government of Venezuela,"This order imposed a full asset freeze on the Government of Venezuela, blocking all government-owned property and interests within U.S. jurisdiction. It also sanctioned individuals and entities providing financial, material, or technological support to previously designated persons. This marked a shift from targeted sanctions to comprehensive economic isolation of the Venezuelan state.","Blocking Property of the Government of Venezuela: This order imposed a full asset freeze on the Government of Venezuela, blocking all government-owned property and interests within U.S. jurisdiction. It also sanctioned individuals and entities providing financial, material, or technological support to previously designated persons. This marked a shift from targeted sanctions to comprehensive economic isolation of the Venezuelan state.",5,High
1/29/2015,Russia,https://www.consilium.europa.eu/en/policies/sanctions-against-russia/timeline-sanctions-against-russia/,Extension of existing individual restrictive measures,"The Council strongly condemned the indiscriminate shelling of the residential areas, especially in Mariupol, and the escalation of fighting in the Donetsk and Luhansk regions of Ukraine. In response to those events, the Council agreed to extend the existing individual restrictive measures, targeting 132 persons and 28 entities for threatening or undermining Ukraine's sovereignty and territorial integrity, until September 2015. It also called for a proposal on additional designations for decision at the Foreign Affairs Council on 9 February 2015.","Extension of existing individual restrictive measures: The Council strongly condemned the indiscriminate shelling of the residential areas, especially in Mariupol, and the escalation of fighting in the Donetsk and Luhansk regions of Ukraine. In response to those events, the Council agreed to extend the existing individual restrictive measures, targeting 132 persons and 28 entities for threatening or undermining Ukraine's sovereignty and territorial integrity, until September 2015. It also called for a proposal on additional designations for decision at the Foreign Affairs Council on 9 February 2015.",2,Medium
2/9/2015,Russia,https://www.consilium.europa.eu/en/policies/sanctions-against-russia/timeline-sanctions-against-russia/,Additional listings on hold,"The Council unanimously adopted additional listings concerning separatists in Eastern Ukraine and their supporters in Russia. These consist of an asset freeze and a travel ban on 19 persons and 9 entities involved in action against Ukraine's territorial integrity. To give space for diplomatic efforts and the Minsk talks, the Council put the entry into force of the measures on hold until Monday 16 February 2015.","Additional listings on hold: The Council unanimously adopted additional listings concerning separatists in Eastern Ukraine and their supporters in Russia. These consist of an asset freeze and a travel ban on 19 persons and 9 entities involved in action against Ukraine's territorial integrity. To give space for diplomatic efforts and the Minsk talks, the Council put the entry into force of the measures on hold until Monday 16 February 2015.",1,Low
2/12/2015,Russia,https://www.consilium.europa.eu/en/policies/sanctions-against-russia/timeline-sanctions-against-russia/,EU leaders welcomed the results of the Minsk agreement,"At an informal meeting of heads of state or government, EU leaders gave cautious support to the Minsk agreement. They indicated that they will not hesitate to take the necessary steps if the agreement is not implemented and the ceasefire is not respected.","EU leaders welcomed the results of the Minsk agreement: At an informal meeting of heads of state or government, EU leaders gave cautious support to the Minsk agreement. They indicated that they will not hesitate to take the necessary steps if the agreement is not implemented and the ceasefire is not respected.",1,Low
2/16/2015,Russia,https://www.consilium.europa.eu/en/policies/sanctions-against-russia/timeline-sanctions-against-russia/,EU strengthens sanctions against separatists in Eastern Ukraine,"As requested by the Foreign Affairs Council of 9 February, an asset freeze and an EU travel ban were imposed to 19 persons and 9 entities involved in action against Ukraine's territorial integrity.","EU strengthens sanctions against separatists in Eastern Ukraine: As requested by the Foreign Affairs Council of 9 February, an asset freeze and an EU travel ban were imposed to 19 persons and 9 entities involved in action against Ukraine's territorial integrity.",1,Low
3/5/2015,Russia,https://www.consilium.europa.eu/en/policies/sanctions-against-russia/timeline-sanctions-against-russia/,Extension of EU sanctions over misappropriation of Ukrainian state funds,The Council adjusted and extended EU restrictive measures focused on the freezing and recovery of misappropriated Ukrainian state funds.,Extension of EU sanctions over misappropriation of Ukrainian state funds: The Council adjusted and extended EU restrictive measures focused on the freezing and recovery of misappropriated Ukrainian state funds.,2,Medium
3/13/2015,Russia,https://www.consilium.europa.eu/en/policies/sanctions-against-russia/timeline-sanctions-against-russia/,Extension of EU sanctions over action against Ukraine's territorial integrity,"The Council extended until 15 September 2015 the application of EU restrictive measures targeting action against Ukraine's sovereignty, territorial integrity and independence. 150 persons and 37 entities are subject to asset freeze and travel bans under these sanctions.","Extension of EU sanctions over action against Ukraine's territorial integrity: The Council extended until 15 September 2015 the application of EU restrictive measures targeting action against Ukraine's sovereignty, territorial integrity and independence. 150 persons and 37 entities are subject to asset freeze and travel bans under these sanctions.",2,Medium
