DATE,COUNTRY,SOURCE,HEADLINE,SUMMARY,TEXT,IMPACT SCORE,IMPACT LEVEL
06/03/2022,Russia,https://www.consilium.europa.eu/en/policies/sanctions-against-russia/timeline-sanctions-against-russia/,Sixth package of sanctions against Russia,"The EU banned most Russian oil imports, imposed SWIFT bans on banks, suspended broadcasting outlets, and sanctioned individuals linked to war atrocities.","Sixth package of sanctions against Russia: The EU banned most Russian oil imports, imposed SWIFT bans on banks, suspended broadcasting outlets, and sanctioned individuals linked to war atrocities.",5,High
06/20/2022,Russia,https://www.consilium.europa.eu/en/policies/sanctions-against-russia/timeline-sanctions-against-russia/,Crimea and Sevastopol sanctions extended,"Sanctions related to Crimea and Sevastopol were extended for one year, restricting trade, investment, tourism, and energy exploration.","Crimea and Sevastopol sanctions extended: Sanctions related to Crimea and Sevastopol were extended for one year, restricting trade, investment, tourism, and energy exploration.",2,Medium
07/21/2022,Russia,https://www.consilium.europa.eu/en/policies/sanctions-against-russia/timeline-sanctions-against-russia/,Maintenance and alignment sanctions package,"The EU banned Russian-origin gold imports, reinforced export controls, clarified existing measures, and sanctioned additional individuals and entities.","Maintenance and alignment sanctions package: The EU banned Russian-origin gold imports, reinforced export controls, clarified existing measures, and sanctioned additional individuals and entities.",5,High
07/26/2022,Russia,https://www.consilium.europa.eu/en/policies/sanctions-against-russia/timeline-sanctions-against-russia/,EU renews economic sanctions,"Economic sanctions targeting finance, energy, transport, and luxury goods were extended until 31 January 2023.","EU renews economic sanctions: Economic sanctions targeting finance, energy, transport, and luxury goods were extended until 31 January 2023.",5,High
08/04/2022,Russia,https://www.consilium.europa.eu/en/policies/sanctions-against-russia/timeline-sanctions-against-russia/,EU sanctions Viktor and Oleksandr Yanukovych,The EU imposed restrictive measures on Viktor Yanukovych and his son for undermining Ukraine’s sovereignty and supporting separatist groups.,EU sanctions Viktor and Oleksandr Yanukovych: The EU imposed restrictive measures on Viktor Yanukovych and his son for undermining Ukraine’s sovereignty and supporting separatist groups.,1,Low
09/14/2022,Russia,https://www.consilium.europa.eu/en/policies/sanctions-against-russia/timeline-sanctions-against-russia/,EU prolongs individual sanctions,Individual sanctions against persons undermining Ukraine’s sovereignty were extended for six months until 15 March 2023.,EU prolongs individual sanctions: Individual sanctions against persons undermining Ukraine’s sovereignty were extended for six months until 15 March 2023.,2,Medium
10/06/2022,Russia,https://www.consilium.europa.eu/en/policies/sanctions-against-russia/timeline-sanctions-against-russia/,Eighth package of sanctions against Russia,"The EU introduced oil transport price caps, expanded restricted military items, and sanctioned additional individuals and entities.","Eighth package of sanctions against Russia: The EU introduced oil transport price caps, expanded restricted military items, and sanctioned additional individuals and entities.",5,High
10/20/2022,Russia,https://www.consilium.europa.eu/en/policies/sanctions-against-russia/timeline-sanctions-against-russia/,EU sanctions Iranian drone suppliers,Three Iranian individuals and one entity were sanctioned for supplying drones used by Russia in Ukraine.,EU sanctions Iranian drone suppliers: Three Iranian individuals and one entity were sanctioned for supplying drones used by Russia in Ukraine.,2,Medium
11/28/2022,Russia,https://www.consilium.europa.eu/en/policies/sanctions-against-russia/timeline-sanctions-against-russia/,EU adds sanctions violations as EU crime,The EU classified sanctions violations as EU crimes to improve enforcement and deter circumvention.,EU adds sanctions violations as EU crime: The EU classified sanctions violations as EU crimes to improve enforcement and deter circumvention.,1,Low
12/03/2022,Russia,https://www.consilium.europa.eu/en/policies/sanctions-against-russia/timeline-sanctions-against-russia/,EU agrees on Russian oil price cap,The EU set a $60 per barrel price cap on Russian crude oil to reduce revenue funding the war.,EU agrees on Russian oil price cap: The EU set a $60 per barrel price cap on Russian crude oil to reduce revenue funding the war.,5,High
12/16/2022,Russia,https://www.consilium.europa.eu/en/policies/sanctions-against-russia/timeline-sanctions-against-russia/,Ninth package of sanctions against Russia,"The EU imposed bans on drone engines, dual-use exports, mining investments, services, sanctioned additional individuals and entities, and suspended Russian media licenses.","Ninth package of sanctions against Russia: The EU imposed bans on drone engines, dual-use exports, mining investments, services, sanctioned additional individuals and entities, and suspended Russian media licenses.",5,High
01/27/2023,Russia,https://www.consilium.europa.eu/en/policies/sanctions-against-russia/timeline-sanctions-against-russia/,EU prolongs economic sanctions over Russia’s military aggression against Ukraine,"The Council extended sectoral economic sanctions against Russia for six months until 31 July 2023, covering key areas such as finance, energy, transport, and technology in response to Russia’s continued military aggression.","EU prolongs economic sanctions over Russia’s military aggression against Ukraine: The Council extended sectoral economic sanctions against Russia for six months until 31 July 2023, covering key areas such as finance, energy, transport, and technology in response to Russia’s continued military aggression.",5,High
02/04/2023,Russia,https://www.consilium.europa.eu/en/policies/sanctions-against-russia/timeline-sanctions-against-russia/,EU agrees on level of price cap for Russian petroleum products,"The EU set price caps on Russian petroleum products under CN code 2710: USD 45 per barrel for products traded at a discount to crude oil and USD 100 per barrel for products traded at a premium, effective from 5 February 2023, in cooperation with the Price Cap Coalition.","EU agrees on level of price cap for Russian petroleum products: The EU set price caps on Russian petroleum products under CN code 2710: USD 45 per barrel for products traded at a discount to crude oil and USD 100 per barrel for products traded at a premium, effective from 5 February 2023, in cooperation with the Price Cap Coalition.",5,High
02/20/2023,Russia,https://www.consilium.europa.eu/en/policies/sanctions-against-russia/timeline-sanctions-against-russia/,EU prolongs restrictions on business with non-government controlled areas of Ukraine,"The Council extended restrictive measures until 24 February 2024 against business activities with non-government controlled areas of Donetsk, Luhansk, Zaporizhzhia, and Kherson, including bans on imports, exports, and advisory services.","EU prolongs restrictions on business with non-government controlled areas of Ukraine: The Council extended restrictive measures until 24 February 2024 against business activities with non-government controlled areas of Donetsk, Luhansk, Zaporizhzhia, and Kherson, including bans on imports, exports, and advisory services.",2,Medium
02/25/2023,Russia,https://www.consilium.europa.eu/en/policies/sanctions-against-russia/timeline-sanctions-against-russia/,10th package of sanctions against Russia,"The EU adopted the tenth sanctions package including bans on exports of critical technology, imports of asphalt and synthetic rubber, gas storage provision, and transit of dual-use goods, suspended RT Arabic and Sputnik Arabic broadcasting, and sanctioned 87 individuals and 34 entities.","10th package of sanctions against Russia: The EU adopted the tenth sanctions package including bans on exports of critical technology, imports of asphalt and synthetic rubber, gas storage provision, and transit of dual-use goods, suspended RT Arabic and Sputnik Arabic broadcasting, and sanctioned 87 individuals and 34 entities.",5,High
03/13/2023,Russia,https://www.consilium.europa.eu/en/policies/sanctions-against-russia/timeline-sanctions-against-russia/,EU renews individual sanctions over Russia’s military aggression against Ukraine,"The Council renewed individual restrictive measures until 15 September 2023, including travel bans, asset freezes, and funding prohibitions, applying to 1,473 individuals and 205 entities.","EU renews individual sanctions over Russia’s military aggression against Ukraine: The Council renewed individual restrictive measures until 15 September 2023, including travel bans, asset freezes, and funding prohibitions, applying to 1,473 individuals and 205 entities.",2,Medium
04/13/2023,Russia,https://www.consilium.europa.eu/en/policies/sanctions-against-russia/timeline-sanctions-against-russia/,Wagner Group and RIA FAN added to the EU sanctions list,"The EU added the Wagner Group and RIA FAN to its sanctions list for undermining Ukraine’s sovereignty, bringing total sanctioned individuals to 1,473 and entities to 207, all subject to asset freezes and funding bans.","Wagner Group and RIA FAN added to the EU sanctions list: The EU added the Wagner Group and RIA FAN to its sanctions list for undermining Ukraine’s sovereignty, bringing total sanctioned individuals to 1,473 and entities to 207, all subject to asset freezes and funding bans.",2,Medium
06/23/2023,Russia,https://www.consilium.europa.eu/en/policies/sanctions-against-russia/timeline-sanctions-against-russia/,11th package of sanctions against Russia,"The EU adopted the eleventh sanctions package to counter circumvention, including tighter export restrictions, bans on transit of goods via Russia, enhanced cooperation with third countries, and sanctions on 71 individuals and 33 entities.","11th package of sanctions against Russia: The EU adopted the eleventh sanctions package to counter circumvention, including tighter export restrictions, bans on transit of goods via Russia, enhanced cooperation with third countries, and sanctions on 71 individuals and 33 entities.",5,High
07/28/2023,Russia,https://www.consilium.europa.eu/en/policies/sanctions-against-russia/timeline-sanctions-against-russia/,Information manipulation in Russia’s war against Ukraine,"The Council sanctioned seven individuals and five entities involved in the “RRN” digital information manipulation campaign, which used fake media websites and social media accounts to spread pro-Russian propaganda within the EU.","Information manipulation in Russia’s war against Ukraine: The Council sanctioned seven individuals and five entities involved in the “RRN” digital information manipulation campaign, which used fake media websites and social media accounts to spread pro-Russian propaganda within the EU.",3,Medium
12/18/2023,Russia,https://www.consilium.europa.eu/en/policies/sanctions-against-russia/timeline-sanctions-against-russia/,12th package of sanctions against Russia,"The EU adopted the twelfth sanctions package targeting high-value sectors, including a ban on Russian diamonds, stricter dual-use export controls, enforcement of oil price caps, prohibition of liquefied propane imports, and sanctions on an additional 61 individuals and 86 entities.","12th package of sanctions against Russia: The EU adopted the twelfth sanctions package targeting high-value sectors, including a ban on Russian diamonds, stricter dual-use export controls, enforcement of oil price caps, prohibition of liquefied propane imports, and sanctions on an additional 61 individuals and 86 entities.",5,High
01/03/2024,Russia,https://www.consilium.europa.eu/en/policies/sanctions-against-russia/timeline-sanctions-against-russia/,EU sanctions Russian diamond firm Alrosa,"The Council added PJSC Alrosa and its CEO to the EU sanctions list, in line with the diamond ban introduced in December 2023. Alrosa accounts for over 90% of Russian diamond production and provides significant revenue to the Russian government.","EU sanctions Russian diamond firm Alrosa: The Council added PJSC Alrosa and its CEO to the EU sanctions list, in line with the diamond ban introduced in December 2023. Alrosa accounts for over 90% of Russian diamond production and provides significant revenue to the Russian government.",1,Low
01/29/2024,Russia,https://www.consilium.europa.eu/en/policies/sanctions-against-russia/timeline-sanctions-against-russia/,Russia: EU imposes new sanctions over human rights violations,"The EU imposed sanctions on four individuals and one entity under the Global Human Rights Sanctions Regime for serious human rights violations, including arbitrary arrests and censorship practices linked to the Russian judicial system.","Russia: EU imposes new sanctions over human rights violations: The EU imposed sanctions on four individuals and one entity under the Global Human Rights Sanctions Regime for serious human rights violations, including arbitrary arrests and censorship practices linked to the Russian judicial system.",3,Medium
01/29/2024,Russia,https://www.consilium.europa.eu/en/policies/sanctions-against-russia/timeline-sanctions-against-russia/,Council renews economic sanctions over Russia’s military aggression against Ukraine,"The Council extended sectoral economic sanctions against Russia for six months until 31 July 2024, covering finance, energy, transport, and technology sectors.","Council renews economic sanctions over Russia’s military aggression against Ukraine: The Council extended sectoral economic sanctions against Russia for six months until 31 July 2024, covering finance, energy, transport, and technology sectors.",5,High
02/12/2024,Russia,https://www.consilium.europa.eu/en/policies/sanctions-against-russia/timeline-sanctions-against-russia/,Immobilised Russian assets: Council decides to set aside extraordinary revenues,"The Council decided that central securities depositories must separately account extraordinary revenues generated from immobilised Russian Central Bank assets, paving the way for future financial support to Ukraine.","Immobilised Russian assets: Council decides to set aside extraordinary revenues: The Council decided that central securities depositories must separately account extraordinary revenues generated from immobilised Russian Central Bank assets, paving the way for future financial support to Ukraine.",5,High
02/23/2024,Russia,https://www.consilium.europa.eu/en/policies/sanctions-against-russia/timeline-sanctions-against-russia/,13th package of sanctions against Russia,"The EU imposed restrictive measures on 106 individuals and 88 entities, targeting the military and defence sectors, judiciary members, and those responsible for the illegal deportation of Ukrainian children, along with new drone and export restrictions.","13th package of sanctions against Russia: The EU imposed restrictive measures on 106 individuals and 88 entities, targeting the military and defence sectors, judiciary members, and those responsible for the illegal deportation of Ukrainian children, along with new drone and export restrictions.",5,High
03/12/2024,Russia,https://www.consilium.europa.eu/en/policies/sanctions-against-russia/timeline-sanctions-against-russia/,EU renews individual sanctions over Russia’s war of aggression against Ukraine,"The Council prolonged individual sanctions until 15 September 2024, including asset freezes and travel bans, applying to over 2,100 individuals and entities linked to Russia’s aggression.","EU renews individual sanctions over Russia’s war of aggression against Ukraine: The Council prolonged individual sanctions until 15 September 2024, including asset freezes and travel bans, applying to over 2,100 individuals and entities linked to Russia’s aggression.",2,Medium
03/22/2024,Russia,https://www.consilium.europa.eu/en/policies/sanctions-against-russia/timeline-sanctions-against-russia/,EU imposes new sanctions over death of Alexei Navalny,"The EU sanctioned 33 individuals and two entities under the Global Human Rights Sanctions Regime in response to the death of Alexei Navalny, including penal colonies, judiciary members, and penitentiary officials.","EU imposes new sanctions over death of Alexei Navalny: The EU sanctioned 33 individuals and two entities under the Global Human Rights Sanctions Regime in response to the death of Alexei Navalny, including penal colonies, judiciary members, and penitentiary officials.",3,Medium
05/17/2024,Russia,https://www.consilium.europa.eu/en/policies/sanctions-against-russia/timeline-sanctions-against-russia/,Council bans four Russian-controlled media outlets,"The Council suspended broadcasting of Voice of Europe, RIA Novosti, Izvestia, and Rossiyskaya Gazeta for spreading Russian propaganda and disinformation supporting the war against Ukraine.","Council bans four Russian-controlled media outlets: The Council suspended broadcasting of Voice of Europe, RIA Novosti, Izvestia, and Rossiyskaya Gazeta for spreading Russian propaganda and disinformation supporting the war against Ukraine.",3,Medium
05/21/2024,Russia,https://www.consilium.europa.eu/en/policies/sanctions-against-russia/timeline-sanctions-against-russia/,EU to use profits from frozen Russian assets to help Ukraine,"The Council approved the use of windfall net profits generated from immobilised Russian assets to support Ukraine’s defence, reconstruction, and recovery through EU programmes.","EU to use profits from frozen Russian assets to help Ukraine: The Council approved the use of windfall net profits generated from immobilised Russian assets to support Ukraine’s defence, reconstruction, and recovery through EU programmes.",4,High
05/27/2024,Russia,https://www.consilium.europa.eu/en/policies/sanctions-against-russia/timeline-sanctions-against-russia/,EU sets up new sanctions framework targeting human rights violations in Russia,"The EU established a country-specific sanctions regime targeting serious human rights violations in Russia, sanctioning 19 individuals and one entity and introducing trade restrictions on repression-related equipment.","EU sets up new sanctions framework targeting human rights violations in Russia: The EU established a country-specific sanctions regime targeting serious human rights violations in Russia, sanctioning 19 individuals and one entity and introducing trade restrictions on repression-related equipment.",3,Medium
05/27/2024,Russia,https://www.consilium.europa.eu/en/policies/sanctions-against-russia/timeline-sanctions-against-russia/,EU imposes new sanctions in response to information manipulation,"The Council sanctioned two individuals and one entity, including Voice of Europe, for propaganda and information manipulation supporting Russia’s war against Ukraine.","EU imposes new sanctions in response to information manipulation: The Council sanctioned two individuals and one entity, including Voice of Europe, for propaganda and information manipulation supporting Russia’s war against Ukraine.",3,Medium
06/17/2024,Russia,https://www.consilium.europa.eu/en/policies/sanctions-against-russia/timeline-sanctions-against-russia/,Crimea and Sevastopol: Council renews sanctions for a further year,"The EU renewed sanctions related to the illegal annexation of Crimea and Sevastopol until 23 June 2025, maintaining restrictions on trade, investment, tourism, and energy activities.","Crimea and Sevastopol: Council renews sanctions for a further year: The EU renewed sanctions related to the illegal annexation of Crimea and Sevastopol until 23 June 2025, maintaining restrictions on trade, investment, tourism, and energy activities.",2,Medium
06/24/2024,Russia,https://www.consilium.europa.eu/en/policies/sanctions-against-russia/timeline-sanctions-against-russia/,14th package of sanctions against Russia,"The EU adopted comprehensive sanctions targeting energy, finance, trade, LNG transshipment, financial messaging systems, aviation, and political funding, and sanctioned 69 individuals and 47 entities.","14th package of sanctions against Russia: The EU adopted comprehensive sanctions targeting energy, finance, trade, LNG transshipment, financial messaging systems, aviation, and political funding, and sanctioned 69 individuals and 47 entities.",5,High
06/28/2024,Russia,https://www.consilium.europa.eu/en/policies/sanctions-against-russia/timeline-sanctions-against-russia/,EU imposes new individual sanctions on Russia,"The Council sanctioned two individuals and four entities for circumventing EU sanctions and materially supporting the Russian government, imposing asset freezes and travel bans.","EU imposes new individual sanctions on Russia: The Council sanctioned two individuals and four entities for circumventing EU sanctions and materially supporting the Russian government, imposing asset freezes and travel bans.",2,Medium
07/22/2024,Russia,https://www.consilium.europa.eu/en/policies/sanctions-against-russia/timeline-sanctions-against-russia/,EU renews economic sanctions against Russia,The Council extended economic sanctions against Russia for six months until 31 January 2025 in response to continued destabilising actions in Ukraine.,EU renews economic sanctions against Russia: The Council extended economic sanctions against Russia for six months until 31 January 2025 in response to continued destabilising actions in Ukraine.,5,High
09/12/2024,Russia,https://www.consilium.europa.eu/en/policies/sanctions-against-russia/timeline-sanctions-against-russia/,EU renews individual sanctions against Russia,"The Council prolonged individual restrictive measures until 15 March 2025, including asset freezes, travel bans, and funding prohibitions.","EU renews individual sanctions against Russia: The Council prolonged individual restrictive measures until 15 March 2025, including asset freezes, travel bans, and funding prohibitions.",2,Medium
10/08/2024,Russia,https://www.consilium.europa.eu/en/policies/sanctions-against-russia/timeline-sanctions-against-russia/,EU adopts new sanctions regime in response to hybrid threats from Russia,"The EU established a new framework to counter hybrid threats such as election interference, cyberattacks, sabotage, disinformation, and the instrumentalisation of migrants.","EU adopts new sanctions regime in response to hybrid threats from Russia: The EU established a new framework to counter hybrid threats such as election interference, cyberattacks, sabotage, disinformation, and the instrumentalisation of migrants.",3,Medium
12/16/2024,Russia,https://www.consilium.europa.eu/en/policies/sanctions-against-russia/timeline-sanctions-against-russia/,15th package of sanctions against Russia,"The EU adopted the fifteenth sanctions package, including sanctions on 54 individuals and 30 entities, bans on shadow fleet vessels, expanded dual-use export restrictions, legal enforcement bans, and extended divestment derogations.","15th package of sanctions against Russia: The EU adopted the fifteenth sanctions package, including sanctions on 54 individuals and 30 entities, bans on shadow fleet vessels, expanded dual-use export restrictions, legal enforcement bans, and extended divestment derogations.",5,High
12/16/2024,Russia,https://www.consilium.europa.eu/en/policies/sanctions-against-russia/timeline-sanctions-against-russia/,EU agrees first listings in response to Russia’s hybrid threats,"The Council imposed restrictive measures on 16 individuals and three entities responsible for Russia’s destabilising hybrid activities, including coordinated information manipulation and interference.","EU agrees first listings in response to Russia’s hybrid threats: The Council imposed restrictive measures on 16 individuals and three entities responsible for Russia’s destabilising hybrid activities, including coordinated information manipulation and interference.",3,Medium
01/27/2025,Russia,https://www.consilium.europa.eu/en/policies/sanctions-against-russia/timeline-sanctions-against-russia/,EU renews economic sanctions against Russia,The Council renewed EU economic restrictive measures against Russia for six months until 31 July 2025 due to Russia’s continued actions destabilising Ukraine.,EU renews economic sanctions against Russia: The Council renewed EU economic restrictive measures against Russia for six months until 31 July 2025 due to Russia’s continued actions destabilising Ukraine.,5,High
02/24/2025,Russia,https://www.consilium.europa.eu/en/policies/sanctions-against-russia/timeline-sanctions-against-russia/,16th package of sanctions against Russia,"The EU adopted the 16th sanctions package, imposing measures on 48 individuals and 35 entities, expanding shadow fleet vessel bans, financial messaging restrictions, export controls on dual-use and energy goods, media suspensions, flight bans, port bans, and additional restrictions on Crimea, Sevastopol, and occupied Ukrainian regions.","16th package of sanctions against Russia: The EU adopted the 16th sanctions package, imposing measures on 48 individuals and 35 entities, expanding shadow fleet vessel bans, financial messaging restrictions, export controls on dual-use and energy goods, media suspensions, flight bans, port bans, and additional restrictions on Crimea, Sevastopol, and occupied Ukrainian regions.",5,High
